{
  "schemaVersion": "ptb-manual-chapter/1",
  "id": "m05",
  "title": "唇形提取",
  "moduleId": "M05",
  "body": {
    "type": "doc",
    "content": [
      {
        "type": "heading",
        "attrs": {
          "id": "m05-purpose",
          "level": 2
        },
        "content": [
          {
            "type": "text",
            "text": "从视频中提取唇形"
          }
        ]
      },
      {
        "type": "paragraph",
        "content": [
          {
            "type": "text",
            "text": "先检查设备和画面，再录制或导入已有视频。本模块显示面部网格、唇形曲线和逐帧参数，可同步回放，并把音视频与数据保存到本机。"
          }
        ]
      },
      {
        "type": "paragraph",
        "content": [
          {
            "type": "text",
            "text": "实时预览和实时录制的唇形标记为候选（candidate）。视频文件分析使用 Face Mesh 模型，两类结果请分别使用。",
            "marks": [
              {
                "type": "bold"
              },
              {
                "type": "textStyle",
                "attrs": {
                  "color": "#3b2f00",
                  "colorDark": "#fff0bb",
                  "backgroundColor": "#fff1c2",
                  "backgroundColorDark": "#514218"
                }
              }
            ]
          }
        ],
        "attrs": {
          "id": "m05-candidate-note"
        }
      },
      {
        "type": "heading",
        "attrs": {
          "id": "m05-layout",
          "level": 3
        },
        "content": [
          {
            "type": "text",
            "text": "先认清工作区"
          }
        ]
      },
      {
        "type": "image",
        "attrs": {
          "id": "m05-figure-m05-overview-r2-light",
          "assetId": "m05-overview-light-scaled-r20261007-v2-876c96c6",
          "caption": "实时预览的准备界面。顶部开始操作，左侧选择设备与参数，中央显示网格和曲线，右侧查看视频与历史。尚未开始采集。",
          "alt": "唇形提取实时预览准备界面，尚未开始采集，设备、模型设置和历史区可见。",
          "width": "100%",
          "align": "center",
          "crop": null,
          "title": ""
        }
      },
      {
        "type": "table",
        "attrs": {
          "id": "m05-layout-table"
        },
        "content": [
          {
            "type": "tableRow",
            "content": [
              {
                "type": "tableHeader",
                "content": [
                  {
                    "type": "paragraph",
                    "content": [
                      {
                        "type": "text",
                        "text": "位置"
                      }
                    ]
                  }
                ]
              },
              {
                "type": "tableHeader",
                "content": [
                  {
                    "type": "paragraph",
                    "content": [
                      {
                        "type": "text",
                        "text": "可以做什么"
                      }
                    ]
                  }
                ]
              }
            ]
          },
          {
            "type": "tableRow",
            "content": [
              {
                "type": "tableCell",
                "content": [
                  {
                    "type": "paragraph",
                    "content": [
                      {
                        "type": "text",
                        "text": "顶部"
                      }
                    ]
                  }
                ]
              },
              {
                "type": "tableCell",
                "content": [
                  {
                    "type": "paragraph",
                    "content": [
                      {
                        "type": "text",
                        "text": "选择实时采集或离线分析，选择文件并开始分析，另存录制、放弃未保存内容、检查偏移量。"
                      }
                    ]
                  }
                ]
              }
            ]
          },
          {
            "type": "tableRow",
            "content": [
              {
                "type": "tableCell",
                "content": [
                  {
                    "type": "paragraph",
                    "content": [
                      {
                        "type": "text",
                        "text": "左栏"
                      }
                    ]
                  }
                ]
              },
              {
                "type": "tableCell",
                "content": [
                  {
                    "type": "paragraph",
                    "content": [
                      {
                        "type": "text",
                        "text": "选摄像头和麦克风，设置帧率与防抖，查看电平、阶段和帧数。"
                      }
                    ]
                  }
                ]
              }
            ]
          },
          {
            "type": "tableRow",
            "content": [
              {
                "type": "tableCell",
                "content": [
                  {
                    "type": "paragraph",
                    "content": [
                      {
                        "type": "text",
                        "text": "中央"
                      }
                    ]
                  }
                ]
              },
              {
                "type": "tableCell",
                "content": [
                  {
                    "type": "paragraph",
                    "content": [
                      {
                        "type": "text",
                        "text": "查看面部网格、九项数值及四条唇形曲线。空白或 — 表示没有有效测量。"
                      }
                    ]
                  }
                ]
              }
            ]
          },
          {
            "type": "tableRow",
            "content": [
              {
                "type": "tableCell",
                "content": [
                  {
                    "type": "paragraph",
                    "content": [
                      {
                        "type": "text",
                        "text": "右栏"
                      }
                    ]
                  }
                ]
              },
              {
                "type": "tableCell",
                "content": [
                  {
                    "type": "paragraph",
                    "content": [
                      {
                        "type": "text",
                        "text": "保存结果、播放视频、恢复历史，或单独导出动画。离线分析入口位于顶部模式菜单。"
                      }
                    ]
                  }
                ]
              }
            ]
          }
        ]
      },
      {
        "type": "paragraph",
        "content": [
          {
            "type": "text",
            "text": "右栏收起后仍会继续采集。"
          },
          {
            "type": "text",
            "text": "录制时保持页面可见",
            "marks": [
              {
                "type": "bold"
              }
            ]
          },
          {
            "type": "text",
            "text": "，后台或切换标签可能影响处理。顶部提示会显示进度、错误或保存结果。"
          }
        ]
      },
      {
        "type": "heading",
        "attrs": {
          "id": "m05-input",
          "level": 2
        },
        "content": [
          {
            "type": "text",
            "text": "准备设备或已有视频"
          }
        ]
      },
      {
        "type": "heading",
        "attrs": {
          "id": "m05-input-camera",
          "level": 3
        },
        "content": [
          {
            "type": "text",
            "text": "采集前检查"
          }
        ]
      },
      {
        "type": "bulletList",
        "content": [
          {
            "type": "listItem",
            "content": [
              {
                "type": "paragraph",
                "content": [
                  {
                    "type": "text",
                    "text": "固定机位，保持面部正对摄像头、嘴唇清楚可见，使用均匀照明。先检查网格是否稳定，避免遮挡和大幅转头。"
                  }
                ]
              }
            ]
          },
          {
            "type": "listItem",
            "content": [
              {
                "type": "paragraph",
                "content": [
                  {
                    "type": "text",
                    "text": "在左栏选择摄像头。录制时还要选择目标麦克风并允许相机、麦克风权限。名称暂时显示未授权时，授权后再核对。"
                  }
                ]
              }
            ]
          },
          {
            "type": "listItem",
            "content": [
              {
                "type": "paragraph",
                "content": [
                  {
                    "type": "text",
                    "text": "先预览，再录一小段：检查"
                  },
                  {
                    "type": "text",
                    "text": "实际输入",
                    "marks": [
                      {
                        "type": "bold"
                      }
                    ]
                  },
                  {
                    "type": "text",
                    "text": "名称、电平和画面，结束后试听。电平变化只表示有信号，仍需确认录到了目标人声。"
                  }
                ]
              }
            ]
          },
          {
            "type": "listItem",
            "content": [
              {
                "type": "paragraph",
                "content": [
                  {
                    "type": "text",
                    "text": "接入新设备后，停止采集再点"
                  },
                  {
                    "type": "text",
                    "text": "刷新设备",
                    "marks": [
                      {
                        "type": "bold"
                      }
                    ]
                  },
                  {
                    "type": "text",
                    "text": "。所选设备消失时需重新选择。避免与录音模块同时占用设备。"
                  }
                ]
              }
            ]
          }
        ],
        "attrs": {
          "id": "m05-preflight-checks"
        }
      },
      {
        "type": "heading",
        "attrs": {
          "id": "m05-input-video",
          "level": 3
        },
        "content": [
          {
            "type": "text",
            "text": "已有视频的要求"
          }
        ]
      },